<?xml version="1.0" encoding="UTF-8"?>
<xsd:schema xmlns:xsd="http://www.w3.org/2001/XMLSchema"  elementFormDefault="qualified">
	<xsd:element name="domain">
		<xsd:complexType>
			<xsd:sequence>
				<xsd:element name="message" minOccurs="0" maxOccurs="unbounded">
					<xsd:complexType>
						<xsd:simpleContent>
							<xsd:extension base="xsd:string">
								<xsd:attribute name="id" type="xsd:string" />
								<xsd:attribute name="code" type="xsd:integer" use="optional" default="0" />
							</xsd:extension>
						</xsd:simpleContent>
					</xsd:complexType>
				</xsd:element>
			</xsd:sequence>
		</xsd:complexType>
	</xsd:element>
</xsd:schema>